{
  "$schema": "../../schemas/rollback-policy.schema.json",
  "schemaVersion": 2,
  "cell": "pulso",
  "policyVersion": "1.3.0",
  "catalogVersion": "1.3.0",
  "rollbackOciComponents": [
    "agent-service",
    "prompt-flow-service",
    "knowledge-service",
    "integration-service",
    "pulso-iris-service",
    "whatsapp-channel-service",
    "pulso-bff",
    "pulso-console"
  ],
  "forwardOnlyOciComponents": [
    "pulso-migrations"
  ],
  "migration": {
    "componentId": "pulso-migrations",
    "sourcePath": "packages/pulso-migrations",
    "files": [
      {
        "path": "sql/001-pulso-autonomous-baseline.sql",
        "sha256": "78166aae10fc425e1d16718c39e387e1d0fdbb3227c7a9a08528fb95379a3904"
      },
      {
        "path": "sql/002-pulso-runtime-roles.sql",
        "sha256": "260599d3c39cd77619a4bb28d68db087ff6e7b38999eca1553f4fb14079ea11c"
      },
      {
        "path": "sql/003-sofia-readiness-marker.sql",
        "sha256": "d972b08edbfdb44225f8de1a25892d449dddfb6f3c29bb918b9581107c1bba84"
      },
      {
        "path": "sql/004-access-channel-tenant-projection.sql",
        "sha256": "cffde8ed7621c40ae9ba4e80969928b705654e530019edf49dacf81730d57c77"
      },
      {
        "path": "sql/005-access-iris-tenant-projection.sql",
        "sha256": "bfa7462090f4626f34096deabcb16f2745539a12a888ed904e79f042ea26959d"
      },
      {
        "path": "sql/006-access-sofia-tenant-projection.sql",
        "sha256": "b2750ee6f2347883df55e666b9eeee4195928041be89e84311b0fcde128c60dc"
      },
      {
        "path": "sql/007-access-integration-tenant-projection.sql",
        "sha256": "b4a7ca5b90c4832c748d058cdb3ae89fd377432d90ce49b42151846a865c8991"
      }
    ]
  }
}
