{
  "$schema": "../../schemas/rollback-policy.schema.json",
  "schemaVersion": 2,
  "cell": "pulso",
  "policyVersion": "1.2.0",
  "catalogVersion": "1.2.0",
  "rollbackOciComponents": [
    "agent-service",
    "prompt-flow-service",
    "knowledge-service",
    "integration-service",
    "pulso-iris-service",
    "whatsapp-channel-service",
    "pulso-bff",
    "pulso-console"
  ],
  "forwardOnlyOciComponents": ["pulso-migrations"],
  "migration": {
    "componentId": "pulso-migrations",
    "sourcePath": "packages/pulso-migrations",
    "files": [
      {
        "path": "sql/001-pulso-autonomous-baseline.sql",
        "sha256": "78166aae10fc425e1d16718c39e387e1d0fdbb3227c7a9a08528fb95379a3904"
      },
      {
        "path": "sql/002-pulso-runtime-roles.sql",
        "sha256": "260599d3c39cd77619a4bb28d68db087ff6e7b38999eca1553f4fb14079ea11c"
      },
      {
        "path": "sql/003-sofia-readiness-marker.sql",
        "sha256": "d972b08edbfdb44225f8de1a25892d449dddfb6f3c29bb918b9581107c1bba84"
      }
    ]
  }
}
